{
    "taxonomy_version": "1.1",
    "generated_from": "App\\Domain\\Communication\\TtpTaxonomySeed::ENTRIES",
    "kill_chain_name": "scambuster-scam-phases",
    "phases": [
        "hook",
        "trust-building",
        "payment-request",
        "escalation",
        "channel-switch",
        "exit"
    ],
    "entry_count": 27,
    "entries": [
        {
            "code": "SB-T001",
            "label": "Unsolicited opportunity lure",
            "definition": "Presents an unsolicited windfall or business opportunity (inheritance, lottery, contract, compensation) as the reason for contact.",
            "phase": "hook",
            "examples": [
                "You have been selected as the beneficiary of $10.5M",
                "Your email address won our international lottery",
                "We seek a reliable partner for an oil contract"
            ],
            "stimulus_affinity": [
                "PASSIVE"
            ],
            "external_refs": [
                {
                    "source_name": "mitre-attack",
                    "external_id": "T1566"
                },
                {
                    "source_name": "mitre-f3",
                    "external_id": "T1598"
                }
            ],
            "active": true,
            "stix_id": "attack-pattern--a49ae9cd-c3ef-55ab-8d40-b90bee8ad544"
        },
        {
            "code": "SB-T002",
            "label": "Institutional authority impersonation",
            "definition": "Claims to represent a government body, bank, court, police or international organization to command compliance.",
            "phase": "hook",
            "examples": [
                "I am the director of the UN compensation commission",
                "This is the FBI fraud division",
                "I write on behalf of the Central Bank"
            ],
            "stimulus_affinity": [
                "PASSIVE",
                "UNKNOWN"
            ],
            "external_refs": [
                {
                    "source_name": "mitre-attack",
                    "external_id": "T1656"
                },
                {
                    "source_name": "mitre-f3",
                    "external_id": "F1032"
                }
            ],
            "active": true,
            "stix_id": "attack-pattern--dc06806d-95be-5141-bfaa-8714c0b6987e"
        },
        {
            "code": "SB-T003",
            "label": "Commercial brand impersonation",
            "definition": "Poses as a known company or consumer service (courier, marketplace, vendor) to exploit its established trust.",
            "phase": "hook",
            "examples": [
                "DHL: your package is on hold pending fees",
                "Your account requires immediate validation",
                "Invoice attached from our sales department"
            ],
            "stimulus_affinity": [
                "PASSIVE"
            ],
            "external_refs": [
                {
                    "source_name": "mitre-attack",
                    "external_id": "T1656"
                },
                {
                    "source_name": "mitre-f3",
                    "external_id": "T1672"
                },
                {
                    "source_name": "mitre-f3",
                    "external_id": "F1036"
                }
            ],
            "active": true,
            "stix_id": "attack-pattern--a054f956-7c23-5a1f-bec4-7212f83dba27"
        },
        {
            "code": "SB-T004",
            "label": "Malicious resource delivery",
            "definition": "Sends a link or attachment the target must open to proceed (portal, form, document, tracking page).",
            "phase": "hook",
            "examples": [
                "Click here to verify your identity",
                "Open the attached invoice",
                "Track your package at this link"
            ],
            "stimulus_affinity": [
                "PASSIVE",
                "DIRECT_REQUEST"
            ],
            "external_refs": [
                {
                    "source_name": "mitre-attack",
                    "external_id": "T1566.001"
                },
                {
                    "source_name": "mitre-attack",
                    "external_id": "T1566.002"
                },
                {
                    "source_name": "mitre-f3",
                    "external_id": "T1660"
                },
                {
                    "source_name": "mitre-f3",
                    "external_id": "T1598"
                }
            ],
            "active": true,
            "stix_id": "attack-pattern--98112338-8f07-5865-a6ef-cb49c2dc4f95"
        },
        {
            "code": "SB-T005",
            "label": "Legitimacy document display",
            "definition": "Volunteers official-looking documents (certificates, IDs, receipts, contracts) to prove authenticity.",
            "phase": "trust-building",
            "examples": [
                "Please find attached the certificate of deposit",
                "Here is a copy of my international passport",
                "See the court approval document"
            ],
            "stimulus_affinity": [
                "DOCUMENT_REQUEST"
            ],
            "external_refs": [
                {
                    "source_name": "mitre-f3",
                    "external_id": "F1020.001"
                },
                {
                    "source_name": "mitre-f3",
                    "external_id": "F1027"
                }
            ],
            "active": true,
            "stix_id": "attack-pattern--6ca0c62b-8e74-5e25-a65d-57f00091abed"
        },
        {
            "code": "SB-T006",
            "label": "Rapport personalization",
            "definition": "Builds an emotional or personal bond (affection, flattery, shared life details) unrelated to the transaction itself.",
            "phase": "trust-building",
            "examples": [
                "My dear, I feel I can trust you",
                "You remind me of my late wife",
                "How is your family doing?"
            ],
            "stimulus_affinity": [
                "TRUST_BUILDING"
            ],
            "external_refs": [],
            "active": true,
            "stix_id": "attack-pattern--6ef13beb-d4b0-5ebf-994e-1f1d4885b864"
        },
        {
            "code": "SB-T007",
            "label": "Religious or moral appeal",
            "definition": "Invokes God, faith or moral duty to frame the exchange as righteous and the target as chosen.",
            "phase": "trust-building",
            "examples": [
                "God has directed me to you",
                "As a God-fearing man, I know you will not betray this trust"
            ],
            "stimulus_affinity": [
                "TRUST_BUILDING",
                "PASSIVE"
            ],
            "external_refs": [],
            "active": true,
            "stix_id": "attack-pattern--d35081f8-b5e4-5334-ac21-5349e3650fae"
        },
        {
            "code": "SB-T008",
            "label": "Fabricated social proof",
            "definition": "Cites invented third parties who already benefited from or vouched for the scheme.",
            "phase": "trust-building",
            "examples": [
                "Mr John from Canada received his payment last week",
                "Many beneficiaries have already been paid this month"
            ],
            "stimulus_affinity": [
                "TRUST_BUILDING"
            ],
            "external_refs": [],
            "active": true,
            "stix_id": "attack-pattern--81cdd1c2-26b4-5c41-a919-f02de6e437db"
        },
        {
            "code": "SB-T009",
            "label": "Secrecy demand",
            "definition": "Instructs the target to keep the transaction confidential from family, banks or authorities.",
            "phase": "trust-building",
            "examples": [
                "Tell no one about this transaction for security reasons",
                "This must remain strictly between us"
            ],
            "stimulus_affinity": [
                "TRUST_BUILDING"
            ],
            "external_refs": [],
            "active": true,
            "stix_id": "attack-pattern--6ac072d6-6293-55f4-b6c6-f07f5b35b451"
        },
        {
            "code": "SB-T010",
            "label": "Intermediary introduction",
            "definition": "Introduces an additional persona (lawyer, banker, diplomat, agent) who must now be dealt with.",
            "phase": "trust-building",
            "examples": [
                "Contact my barrister at the address below",
                "The bank director will write to you directly"
            ],
            "stimulus_affinity": [
                "DIRECT_REQUEST",
                "DOCUMENT_REQUEST"
            ],
            "external_refs": [
                {
                    "source_name": "mitre-f3",
                    "external_id": "T1585"
                }
            ],
            "active": true,
            "stix_id": "attack-pattern--c0042160-be1e-5751-b1bf-ce5ef017ddb5"
        },
        {
            "code": "SB-T011",
            "label": "Plausibility repair",
            "definition": "Explains away inconsistencies, delays or contradictions the target has noticed.",
            "phase": "trust-building",
            "examples": [
                "The delay is due to the Easter holidays",
                "The fee changed because of new government regulations",
                "My other email was hacked, hence this address"
            ],
            "stimulus_affinity": [
                "DOCUMENT_REQUEST",
                "DIRECT_REQUEST"
            ],
            "external_refs": [],
            "active": true,
            "stix_id": "attack-pattern--3795fc39-ed59-5ce6-a619-835b23500010"
        },
        {